<?xml version="1.0" encoding="UTF-8"?>
<!DOCTYPE familia SYSTEM "DTD.dtd">
 <familia codigo="S01-07">
    <padre>
        <nombre>Benito</nombre>
        <apellido>S치nchez</apellido>
        <apellido>Gil</apellido>
        <dni>77.987.555-E</dni>
    </padre>
    <madre>
        <nombre>Mercedes</nombre>
        <apellido>Juli치</apellido>
        <apellido>Flores</apellido>
    </madre>
    <hijos>
        <hija pos="1">
            <nombre>Mercedes</nombre>
            <apellido>S치nchez</apellido>
            <apellido>Juli치</apellido>            
        </hija>
    </hijos>
</familia>
