<?xml version="1.0" encoding="UTF-8"?>
<!DOCTYPE familia SYSTEM "DTD.dtd">
<familia codigo="P01-07">
    <padre>
        <nombre>Antonio</nombre>
        <apellido>Pérez</apellido>
        <apellido>Rodríguez</apellido>
        <dni>12.345.678-A</dni>
    </padre>
    <madre>
        <nombre>Elena</nombre>
        <apellido>Roldán</apellido>
        <apellido>Benítez</apellido>
        <dni>90.123.456-B</dni>
    </madre>
    <hijos>
        <hijo pos="2">
            <nombre>Alejandro</nombre>
            <apellido>Pérez</apellido>
            <apellido>Roldán</apellido>
            <edad>12</edad>
        </hijo>
        <hijo pos="3">
            <nombre>Manuel</nombre>
            <apellido>Pérez</apellido>
            <apellido>Roldán</apellido>
            <edad>6</edad>
        </hijo>
        <hija pos="1">
            <nombre>Elena</nombre>
            <apellido>Pérez</apellido>
            <apellido>Roldán</apellido>
            <dni>78.901.234-C</dni>
        </hija>
    </hijos>
</familia>